{
  "$id": "https://raw.githubusercontent.com/NatesVibeCode/harness-fleet/master/schemas/task-v1.schema.json",
  "$schema": "https://json-schema.org/draft/2020-12/schema",
  "additionalProperties": false,
  "properties": {
    "$schema": {
      "const": "https://raw.githubusercontent.com/NatesVibeCode/harness-fleet/master/schemas/task-v1.schema.json",
      "default": "https://raw.githubusercontent.com/NatesVibeCode/harness-fleet/master/schemas/task-v1.schema.json",
      "title": "$Schema",
      "type": "string"
    },
    "format_version": {
      "const": "harness_fleet_task_v1",
      "default": "harness_fleet_task_v1",
      "title": "Format Version",
      "type": "string"
    },
    "name": {
      "description": "Stable task name",
      "maxLength": 128,
      "minLength": 1,
      "pattern": "^[A-Za-z0-9_.-]+$",
      "title": "Name",
      "type": "string"
    },
    "instructions": {
      "default": "Extract only facts supported by the supplied source slices.",
      "description": "Outcome-specific directions; field structure belongs in claims_schema",
      "title": "Instructions",
      "type": "string"
    },
    "batch_size": {
      "default": 6,
      "description": "Maximum input items per model request",
      "maximum": 100,
      "minimum": 1,
      "title": "Batch Size",
      "type": "integer"
    },
    "max_slice_chars": {
      "default": 6000,
      "description": "Maximum source characters exposed per item",
      "maximum": 100000,
      "minimum": 300,
      "title": "Max Slice Chars",
      "type": "integer"
    },
    "min_quote_chars": {
      "default": 15,
      "description": "Minimum admitted evidence-quote length",
      "maximum": 10000,
      "minimum": 1,
      "title": "Min Quote Chars",
      "type": "integer"
    },
    "claims_schema": {
      "additionalProperties": true,
      "description": "Draft 2020-12 object schema; type=object and additionalProperties=false are required",
      "title": "Claims Schema",
      "type": "object"
    },
    "checklist": {
      "anyOf": [
        {
          "additionalProperties": {
            "type": "integer"
          },
          "type": "object"
        },
        {
          "type": "null"
        }
      ],
      "default": null,
      "description": "Checklist item id to score points; the pipeline derives score from true answers",
      "title": "Checklist"
    },
    "pass_score": {
      "anyOf": [
        {
          "maximum": 100,
          "minimum": 0,
          "type": "integer"
        },
        {
          "type": "null"
        }
      ],
      "default": null,
      "description": "Minimum derived score that yields passed=true; the pipeline derives the boolean",
      "title": "Pass Score"
    },
    "evidence_terms": {
      "description": "Terms used to rank deterministic evidence-candidate spans per section",
      "items": {
        "type": "string"
      },
      "title": "Evidence Terms",
      "type": "array"
    },
    "candidate_top_n": {
      "default": 6,
      "description": "Maximum evidence-candidate spans exposed per section",
      "maximum": 32,
      "minimum": 1,
      "title": "Candidate Top N",
      "type": "integer"
    },
    "source_weights": {
      "additionalProperties": {
        "type": "number"
      },
      "description": "Lowercased URI substring to evidentiary weight 0-1; longest match wins, 0 blocks support",
      "title": "Source Weights",
      "type": "object"
    },
    "default_source_weight": {
      "default": 1.0,
      "description": "Weight for sources matching no rule; 1 preserves legacy unweighted scoring",
      "maximum": 1.0,
      "minimum": 0.0,
      "title": "Default Source Weight",
      "type": "number"
    },
    "recency_half_lives": {
      "additionalProperties": {
        "type": "number"
      },
      "description": "Checklist item id to evidence half-life in days; support decays by half each period",
      "title": "Recency Half Lives",
      "type": "object"
    }
  },
  "required": [
    "name"
  ],
  "title": "TaskSpec",
  "type": "object"
}
