{
  "$schema": "https://raw.githubusercontent.com/NatesVibeCode/harness-fleet/master/schemas/task-v1.schema.json",
  "format_version": "harness_fleet_task_v1",
  "name": "account_research",
  "instructions": "Evaluate target account technical fit, assign an ICP fit score from 0 to 100 based on infrastructure bottlenecks or data scale, identify key technical gaps, and cite verbatim evidence.",
  "batch_size": 5,
  "max_slice_chars": 6000,
  "min_quote_chars": 15,
  "claims_schema": {
    "type": "object",
    "properties": {
      "score": {
        "type": "integer",
        "minimum": 0,
        "maximum": 100,
        "description": "ICP fit: 85-100 active explicit initiative quoted verbatim, 70-84 confirmed stack plus senior infra hiring, 50-69 firmographic fit only, 0-49 incompatible stack or wrong model."
      },
      "fit_tier": {
        "type": "string",
        "enum": ["tier_1", "tier_2", "tier_3", "unfit"],
        "description": "Score band: tier_1 85-100, tier_2 70-84, tier_3 50-69, unfit below 50. Must equal the score band."
      },
      "identified_gap": {
        "type": "string",
        "description": "The verified technical initiative or bottleneck, named exactly as the source names it."
      },
      "reasoning": {
        "type": "string",
        "description": "Short explanation grounded in the cited quotes, naming the evidence behind score and gap."
      }
    },
    "required": ["score", "fit_tier", "identified_gap", "reasoning"],
    "additionalProperties": false
  }
}
